{
  "$schema": "../../schema/scenario.v1.json",
  "specVersion": "1.0",
  "id": "resilience.throttling-retry",
  "title": "Throttling retries respect operation policy",
  "requirement": "A bounded sequence of injected 429 responses is retried according to operation settings and succeeds with every attempt represented in diagnostics.",
  "maturity": "stable",
  "precedents": [
    {
      "sdk": "rust",
      "path": "sdk/cosmos/azure_data_cosmos/tests/emulator_tests/cosmos_fault_injection.rs",
      "test": "fault_injection_429_retry_with_hit_limit"
    }
  ],
  "profiles": [
    "configurationResilience"
  ],
  "tags": [
    "resilience",
    "retry",
    "faultInjection"
  ],
  "backends": {
    "hostedEmulatorGatewayV1": {
      "applicability": "required",
      "fidelity": "full",
      "requires": [
        "item"
      ]
    },
    "hostedEmulatorGatewayV2": {
      "applicability": "required",
      "fidelity": "full",
      "requires": [
        "item",
        "gatewayV2"
      ]
    },
    "azureLive": {
      "applicability": "notApplicable",
      "fidelity": "none",
      "reason": "The scenario intentionally injects synthetic transport outcomes."
    }
  }
}
