{
    "$schema": "../../schema/scenario.v1.json",
    "specVersion": "1.0",
    "id": "topology.write-failover",
    "title": "Writes recover through failover and failback",
    "requirement": "A running client refreshes account topology and redirects writes through announced, active, and completed write-region failover and failback phases.",
    "maturity": "stable",
    "precedents": [
        {
            "sdk": "rust",
            "path": "sdk/cosmos/azure_data_cosmos_driver/tests/in_memory_emulator_tests/region_online_offline.rs",
            "test": "writes_follow_the_new_write_region_after_failover"
        }
    ],
    "profiles": [
        "dynamicTopology"
    ],
    "tags": [
        "topology",
        "failover",
        "write"
    ],
    "backends": {
        "hostedEmulatorGatewayV1": {
            "applicability": "simulated",
            "fidelity": "simulated",
            "reason": "Hosted controls expose each deterministic failover phase.",
            "requires": [
                "item",
                "writeRegionFailover"
            ]
        },
        "hostedEmulatorGatewayV2": {
            "applicability": "simulated",
            "fidelity": "simulated",
            "reason": "Hosted controls expose each deterministic failover phase.",
            "requires": [
                "item",
                "writeRegionFailover",
                "gatewayV2"
            ]
        },
        "azureLive": {
            "applicability": "notApplicable",
            "fidelity": "none",
            "reason": "The scenario requires deterministic write-region transition timing."
        }
    }
}